{
  "base_sha": "22177dafe5d824e3383fc70b6ab6fa164b64344f",
  "changed_paths": [
    ".github/workflows/validate-repository.yml",
    "AGENTS.md",
    "BOOTSTRAP.md",
    "CHANGELOG.md",
    "CURRENT_VERSION",
    "README.md",
    "planning/NEXT_WORK.md",
    "planning/PR_INSPECTOR_EXECUTION_PLAN.md",
    "planning/progress/impacts/PINS-FUNCTIONAL-BOOTSTRAP-001.implementation.json",
    "planning/scopes/PINS-FUNCTIONAL-BOOTSTRAP-001.scope.json",
    "planning/tasks/task-registry.v1.json",
    "pr_inspector/__init__.py",
    "pr_inspector/_official_complete.py",
    "pr_inspector/behavioral_coverage.py",
    "pr_inspector/functional_review.py",
    "pr_inspector/functional_runtime.py",
    "pr_inspector/planning_governance.py",
    "pr_inspector/validation_v2.py",
    "protocol-manifest.yaml",
    "protocols/v1.13.0/PR_REVIEW_CONTRACT.md",
    "protocols/v1.13.0/functional-runtime-contract.json",
    "protocols/v1.13.0/pipeline/REVIEW_PIPELINE.md",
    "protocols/v1.13.0/policies/BEHAVIORAL_RULE_COVERAGE.md",
    "protocols/v1.13.0/policies/GOVERNANCE_BEHAVIORAL_RULE_COVERAGE.md",
    "protocols/v1.13.0/policies/OWNER_DELIVERY_CONTRACT.json",
    "protocols/v1.13.0/prompts/INTAKE_RESPONSE.fa.md",
    "protocols/v1.13.0/registries/DECISION_REASON_REGISTRY.yaml",
    "protocols/v1.13.0/schemas/ci-identity.schema.json",
    "protocols/v1.13.0/schemas/decision-projection.schema.json",
    "protocols/v1.13.0/schemas/functional-runtime-contract.schema.json",
    "protocols/v1.13.0/schemas/governance-evidence.schema.json",
    "protocols/v1.13.0/schemas/owner-delivery-contract.schema.json",
    "protocols/v1.13.0/schemas/rereview-sequence.schema.json",
    "protocols/v1.13.0/schemas/review-assessment.schema.json",
    "protocols/v1.13.0/schemas/review-package.schema.json",
    "protocols/v1.13.0/templates/OWNER_DECISION_CARD.fa.md",
    "protocols/v1.13.0/templates/TECHNICAL_HANDOFF.en.md",
    "pyproject.toml",
    "release-locks/v1.13.0.sha256",
    "scripts/validate_planning_governance.py",
    "scripts/validate_runtime_contract.py",
    "tests/test_aigov_release_integrity.py",
    "tests/test_aigov_schemas.py",
    "tests/test_planning_governance.py",
    "tests/test_repository_closure.py",
    "tests/test_v1_13_evidence_completeness.py",
    "tests/test_v1_13_functional_bootstrap.py",
    "tests/test_v1_13_planning_governance.py",
    "tests/test_v1_13_verified_review_authority.py"
  ],
  "classification": "protocol_authority_migration",
  "completed_obligations": [
    "registered and authorized planning task",
    "created exact scope and impact",
    "implemented functional contract and loader",
    "separated runtime and full release validation",
    "migrated behavioral rule inventory",
    "preserved target review and owner delivery adapters"
  ],
  "completion_claimed": false,
  "head_binding": "derived_at_runtime",
  "impact_id": "PINS-FUNCTIONAL-BOOTSTRAP-001-IMPACT-001",
  "initiative_id": "PRINS-FUNCTIONAL-BOOTSTRAP",
  "known_gaps": [
    "local full-repository execution was unavailable; exact candidate validation is delegated to GitHub Actions"
  ],
  "material_progress": true,
  "next_lifecycle_action": "exact_head_validation",
  "previous_impact_ref": null,
  "program_id": "PRINS-GOVERNED-EXECUTION-PROGRAM",
  "remaining_obligations": [
    "exact_head_github_actions_validation",
    "independent_review_if_required_by_repository_policy",
    "owner_only_merge",
    "successful_push_validation_on_exact_main",
    "bounded_post_merge_lifecycle_reconciliation"
  ],
  "repository": "rezahh107/PR-Inspector",
  "schema_version": "progress-impact.v1",
  "scope_id": "PINS-FUNCTIONAL-BOOTSTRAP-001-SCOPE-001",
  "sequence": 1,
  "state_after": "v1.13 functional contract implemented pending exact-Head CI validation and independent review",
  "state_before": "v1.12 per-review bootstrap coupled to remote Inspector attestation and full repository validation",
  "task_id": "PINS-FUNCTIONAL-BOOTSTRAP-001",
  "work_package_id": "PINS-FUNCTIONAL-BOOTSTRAP-001-WP01",
  "zero_progress": false
}
