{
  "schema_version": "progress-impact.v1",
  "impact_id": "PINS-VERIFIED-REVIEW-001-WP01-IMPACT-001",
  "sequence": 1,
  "previous_impact_ref": null,
  "program_id": "PRINS-GOVERNED-EXECUTION-PROGRAM",
  "initiative_id": "PRINS-VERIFIED-REVIEW-AUTHORITY",
  "task_id": "PINS-VERIFIED-REVIEW-001",
  "work_package_id": "PINS-VERIFIED-REVIEW-001-WP01",
  "scope_id": "pins-verified-review-001-wp01",
  "repository": "rezahh107/PR-Inspector",
  "base_sha": "273ba7d4a6930015eb07c32c5de7210fa4692b1c",
  "head_binding": "derived_at_runtime",
  "changed_paths": [
    ".github/workflows/validate-repository.yml",
    "CHANGELOG.md",
    "CURRENT_VERSION",
    "README.md",
    "docs/v1.12.0-authority-mutation-baseline.md",
    "fixtures/behavioral-rules/mutation-cases.json",
    "planning/NEXT_WORK.md",
    "planning/PR_INSPECTOR_EXECUTION_PLAN.md",
    "planning/progress/impacts/PINS-VERIFIED-REVIEW-001.implementation.json",
    "planning/scopes/PINS-VERIFIED-REVIEW-001.scope.json",
    "planning/tasks/task-registry.v1.json",
    "pr_inspector/__init__.py",
    "pr_inspector/_official_bundle.py",
    "pr_inspector/_official_complete.py",
    "pr_inspector/_official_head.py",
    "pr_inspector/behavioral_coverage.py",
    "pr_inspector/decision_projection_core.py",
    "pr_inspector/official_review.py",
    "pr_inspector/planning_governance_artifacts.py",
    "pr_inspector/planning_governance_base.py",
    "pr_inspector/planning_governance_git.py",
    "pr_inspector/planning_governance_repository.py",
    "pr_inspector/review_provenance.py",
    "pr_inspector/security_profile.py",
    "pr_inspector/validation_v2.py",
    "pr_inspector/verified_review.py",
    "protocol-manifest.yaml",
    "protocols/v1.12.0/MIGRATION_FROM_V1.11.1.md",
    "protocols/v1.12.0/PR_REVIEW_CONTRACT.md",
    "protocols/v1.12.0/pipeline/REVIEW_PIPELINE.md",
    "protocols/v1.12.0/policies/BEHAVIORAL_RULE_COVERAGE.md",
    "protocols/v1.12.0/policies/CANONICAL_OUTPUT_BEHAVIORAL_RULE_COVERAGE.md",
    "protocols/v1.12.0/policies/DECISION_GATES.md",
    "protocols/v1.12.0/policies/DERIVED_OUTPUTS.md",
    "protocols/v1.12.0/policies/EXTERNAL_COVERAGE_TRUST.md",
    "protocols/v1.12.0/policies/GOVERNANCE_BEHAVIORAL_RULE_COVERAGE.md",
    "protocols/v1.12.0/policies/MERGE_GOVERNANCE.md",
    "protocols/v1.12.0/policies/OWNER_DELIVERY_CONTRACT.json",
    "protocols/v1.12.0/policies/OWNER_OUTPUT_UX.md",
    "protocols/v1.12.0/policies/PERSONAL_MINIMUM_SECURITY_PROFILE.md",
    "protocols/v1.12.0/policies/SECURITY_AND_TRUST.md",
    "protocols/v1.12.0/policies/VERIFIED_REVIEW_AUTHORITY.md",
    "protocols/v1.12.0/prompts/INTAKE_RESPONSE.fa.md",
    "protocols/v1.12.0/registries/DECISION_REASON_REGISTRY.yaml",
    "protocols/v1.12.0/schemas/ci-identity.schema.json",
    "protocols/v1.12.0/schemas/decision-projection.schema.json",
    "protocols/v1.12.0/schemas/governance-evidence.schema.json",
    "protocols/v1.12.0/schemas/owner-delivery-contract.schema.json",
    "protocols/v1.12.0/schemas/rereview-sequence.schema.json",
    "protocols/v1.12.0/schemas/review-assessment.schema.json",
    "protocols/v1.12.0/schemas/review-package.schema.json",
    "protocols/v1.12.0/templates/OWNER_DECISION_CARD.fa.md",
    "protocols/v1.12.0/templates/TECHNICAL_HANDOFF.en.md",
    "protocols/v1.12.0/trust/INSPECTOR_TRUST_POLICY.json",
    "pyproject.toml",
    "release-locks/v1.12.0.sha256",
    "schemas/planning/progress-impact.v1.schema.json",
    "schemas/planning/work-package-scope.v1.schema.json",
    "scripts/render_review_v2.py",
    "tests/test_aigov_release_integrity.py",
    "tests/test_aigov_schemas.py",
    "tests/test_atomic_owner_delivery.py",
    "tests/test_behavioral_rule_coverage.py",
    "tests/test_candidate_v1_11.py",
    "tests/test_canonical_output_atomicity.py",
    "tests/test_canonical_output_enforcement.py",
    "tests/test_personal_minimum_security_profile.py",
    "tests/test_planning_governance.py",
    "tests/test_planning_governance_authority.py",
    "tests/test_render_cli_owner_delivery.py",
    "tests/test_repository_closure.py",
    "tests/test_v1_12_evidence_completeness.py",
    "tests/test_v1_12_verified_review_authority.py",
    "tests/verified_review_test_support.py"
  ],
  "classification": "protocol_authority_migration",
  "state_before": "planned",
  "state_after": "implementing",
  "completed_obligations": [
    "adversarial_tests_added",
    "complete_check_pagination_implemented",
    "complete_review_surface_pagination_implemented",
    "deterministic_in_process_assembler_implemented",
    "external_review_reconciliation_implemented",
    "governing_reference_verified",
    "local_evidence_completeness_tests_passed",
    "local_full_repository_test_suite_passed",
    "missing_required_checks_fail_closed",
    "official_package_assembly_boundary_implemented",
    "public_runtime_authority_injection_removed",
    "temporary_export_workflow_removed",
    "v1_11_1_authority_bypass_reproduced"
  ],
  "remaining_obligations": [
    "exact_head_github_actions_validation",
    "fresh_independent_rereview",
    "owner_merge_evidence",
    "post_merge_lifecycle_reconciliation"
  ],
  "known_gaps": [
    "exact-Head GitHub Actions evidence pending",
    "fresh independent PR Inspector rereview pending"
  ],
  "material_progress": true,
  "zero_progress": false,
  "completion_claimed": false,
  "next_lifecycle_action": "exact_head_validation",
  "deleted_paths": [
    ".github/workflows/export-pr21-rerepair.yml"
  ]
}
