{
  "schema_version": "progress-impact.v1",
  "impact_id": "PINS-PLAN-001-WP01-IMPACT-001",
  "sequence": 1,
  "previous_impact_ref": null,
  "program_id": "PRINS-GOVERNED-EXECUTION-PROGRAM",
  "initiative_id": "PRINS-PLANNING-FOUNDATION",
  "task_id": "PINS-PLAN-001",
  "work_package_id": "PINS-PLAN-001-WP01",
  "scope_id": "pins-plan-001-wp01",
  "repository": "rezahh107/PR-Inspector",
  "base_sha": "6be25811d185f001025b61839f94c736c721bbb7",
  "head_binding": "derived_at_runtime",
  "changed_paths": [
    ".github/workflows/validate-repository.yml",
    "AGENTS.md",
    "README.md",
    "docs/MAINTENANCE.md",
    "planning/NEXT_WORK.md",
    "planning/PR_INSPECTOR_EXECUTION_PLAN.md",
    "planning/PR_INSPECTOR_EXECUTION_PLAN_BASELINE.md",
    "planning/progress/impacts/PINS-PLAN-001.implementation.json",
    "planning/scopes/PINS-PLAN-001.scope.json",
    "planning/tasks/task-registry.v1.json",
    "pr_inspector/planning_governance.py",
    "pr_inspector/planning_governance_artifacts.py",
    "pr_inspector/planning_governance_base.py",
    "pr_inspector/planning_governance_git.py",
    "pr_inspector/planning_governance_registry.py",
    "pr_inspector/planning_governance_repository.py",
    "schemas/planning/progress-impact.v1.schema.json",
    "schemas/planning/task-registry.v1.schema.json",
    "schemas/planning/work-package-scope.v1.schema.json",
    "scripts/validate_planning_governance.py",
    "scripts/validate_repository_v2.py",
    "tests/fixtures/planning/adversarial/cases.json",
    "tests/fixtures/planning/adversarial/duplicate-key.registry.json",
    "tests/fixtures/planning/adversarial/malformed-markers.md",
    "tests/fixtures/planning/invalid/cases.json",
    "tests/fixtures/planning/invalid/dashboard-drift.md",
    "tests/fixtures/planning/valid/dashboard.md",
    "tests/fixtures/planning/valid/impact.json",
    "tests/fixtures/planning/valid/registry.json",
    "tests/fixtures/planning/valid/scope.json",
    "tests/test_planning_governance.py",
    "tests/test_planning_governance_authority.py"
  ],
  "classification": "planning_infrastructure",
  "state_before": "absent",
  "state_after": "in_progress",
  "completed_obligations": [
    "canonical_registry_created",
    "current_scope_declared",
    "implementation_impact_recorded",
    "static_semantic_validation_implemented",
    "git_bound_exact_scope_validation_implemented",
    "planning_ci_integration_declared"
  ],
  "remaining_obligations": [
    "exact_head_github_actions_validation",
    "independent_review_if_required_by_repository_policy",
    "owner_only_merge",
    "successful_push_validation_on_exact_main",
    "bounded_post_merge_lifecycle_reconciliation"
  ],
  "known_gaps": [
    "exact_head_ci_result_pending",
    "repository_settings_merge_enforcement_unverified",
    "post_merge_evidence_absent"
  ],
  "material_progress": true,
  "zero_progress": false,
  "completion_claimed": false,
  "next_lifecycle_action": "exact_head_validation"
}
